Offshore Adventures,Offshore Adventures Series 08,D0167,Factual,"Fischer Productions, LLC",English,2006,12 x 30',,TRUE,FALSE,TRUE,FALSE,24/01/2008 00:00,23/01/2013 00:00,23/01/2018 00:00,,TRUE,37.5% with 10% of the 37.5% to be paid to Raleigh Werking,,"TERRITORY: Worldwide excluding USA and its possessions. RIGHTS: NON-EXCLUSIVE Non-theatrical, Free TV, Pay TV, Videogram & New Media Rights - provided any grant of any forms of downloading is encrypted and will not allow unlawful copying. NB: Distributor’s rights herein shall be non-exclusive with respect to the rights Producer has already granted or agrees to grant to ESPN and The Outdoor Channel. In addition, the Prod retains the right to exploit the Programmes via DVD and home video and via the internet through its own distribution channels.","Prior to agreeing license Indigo is to supply copies of the agreements for Producer’s approval, said approval not to be unreasonably withheld. Sub-Licensing up to five years beyond the Term provided said broadcaster has already been airing the Programme during at least one year of the Term.","Marketing expenses (including but not limited to flyers, brochures, advertising, print materials, posters, images, web digitisation, reasonable market expenses) and distribution costs (including but not limited to screening cassettes, promotional material and couriers) are included in the Distribution Fee. All actual and direct costs paid by Distributor relating to servicing agreements with licensees (but for the avoidance of doubt, not license or sub distribution fees themselves) (including but not limited to festival registration fees, transmission materials, duplication, shipping costs, insurance and scripts and transparencies) will be deducted from Gross Receipts unless paid for by Broadcaster or Licensee.",First refusal paragraph deleted - not granted.,"7.5.08 note: no M&E tracks on seasons 1-7. All newer seasons are fine. 7.5.08 note: Season 7 is a best of/recap of seasons 1-6. Producer can terminate agreement if Distributor has not secured $50,000 (across Offshore, Wanna Go Fishing, American Gun Dog) by 23rd Jan 2009. 20.03.08 ""Offshore Adventures"" - winner of two 2007 Rocky Mountain (Regional) Emmy Awards - Best Editor and Best Sports - Program Feature/Segment/Regular Scheduled Daily or Weekly Program.","Season 12 & 13 (not in agreement) are available for distribution in Europe, as well as countries surrounding Russia such as Ukraine, but NOT Russia (Nick's e 30.4.08).",Quarterly - 45 days after each calendar quarter.,,Status 3Offshore Adventures,Offshore Adventures Series 09,D0167,Factual,"Fischer Productions, LLC",English,2006,12 x 30',,TRUE,FALSE,TRUE,FALSE,24/01/2008 00:00,23/01/2013 00:00,23/01/2018 00:00,,TRUE,37.5% with 10% of the 37.5% to be paid to Raleigh Werking,,"TERRITORY: Worldwide excluding USA and its possessions. RIGHTS: NON-EXCLUSIVE Non-theatrical, Free TV, Pay TV, Videogram & New Media Rights - provided any grant of any forms of downloading is encrypted and will not allow unlawful copying. NB: Distributor’s rights herein shall be non-exclusive with respect to the rights Producer has already granted or agrees to grant to ESPN and The Outdoor Channel. In addition, the Prod retains the right to exploit the Programmes via DVD and home video and via the internet through its own distribution channels.","Prior to agreeing license Indigo is to supply copies of the agreements for Producer’s approval, said approval not to be unreasonably withheld. Sub-Licensing up to five years beyond the Term provided said broadcaster has already been airing the Programme during at least one year of the Term.","Marketing expenses (including but not limited to flyers, brochures, advertising, print materials, posters, images, web digitisation, reasonable market expenses) and distribution costs (including but not limited to screening cassettes, promotional material and couriers) are included in the Distribution Fee. All actual and direct costs paid by Distributor relating to servicing agreements with licensees (but for the avoidance of doubt, not license or sub distribution fees themselves) (including but not limited to festival registration fees, transmission materials, duplication, shipping costs, insurance and scripts and transparencies) will be deducted from Gross Receipts unless paid for by Broadcaster or Licensee.",First refusal paragraph deleted - not granted.,"7.5.08 note: no M&E tracks on seasons 1-7. All newer seasons are fine. 7.5.08 note: Season 7 is a best of/recap of seasons 1-6. Producer can terminate agreement if Distributor has not secured $50,000 (across Offshore, Wanna Go Fishing, American Gun Dog) by 23rd Jan 2009. 20.03.08 ""Offshore Adventures"" - winner of two 2007 Rocky Mountain (Regional) Emmy Awards - Best Editor and Best Sports - Program Feature/Segment/Regular Scheduled Daily or Weekly Program.","Seasons 12 & 13 (not in agreement) are available for distribution in Europe, as well as countries surrounding Russia such as Ukraine, but NOT Russia (Nick's e 30.4.08).",Quarterly - 45 days after each calendar quarter.,,Status 3Offshore Adventures,Offshore Adventures Series 10,D0167,Factual,"Fischer Productions, LLC",English,2007,12 x 30',,TRUE,FALSE,TRUE,FALSE,24/01/2008 00:00,23/01/2013 00:00,23/01/2018 00:00,,TRUE,37.5% with 10% of the 37.5% to be paid to Raleigh Werking,,"TERRITORY: Worldwide excluding USA and its possessions. RIGHTS: NON-EXCLUSIVE Non-theatrical, Free TV, Pay TV, Videogram & New Media Rights - provided any grant of any forms of downloading is encrypted and will not allow unlawful copying. NB: Distributor’s rights herein shall be non-exclusive with respect to the rights Producer has already granted or agrees to grant to ESPN and The Outdoor Channel. In addition, the Prod retains the right to exploit the Programmes via DVD and home video and via the internet through its own distribution channels.","Prior to agreeing license Indigo is to supply copies of the agreements for Producer’s approval, said approval not to be unreasonably withheld. Sub-Licensing up to five years beyond the Term provided said broadcaster has already been airing the Programme during at least one year of the Term.","Marketing expenses (including but not limited to flyers, brochures, advertising, print materials, posters, images, web digitisation, reasonable market expenses) and distribution costs (including but not limited to screening cassettes, promotional material and couriers) are included in the Distribution Fee. All actual and direct costs paid by Distributor relating to servicing agreements with licensees (but for the avoidance of doubt, not license or sub distribution fees themselves) (including but not limited to festival registration fees, transmission materials, duplication, shipping costs, insurance and scripts and transparencies) will be deducted from Gross Receipts unless paid for by Broadcaster or Licensee.",First refusal paragraph deleted - not granted.,"16.9.08 reported material problem with S10 ep 10 - texted areas have been blurred out (as per producer's master). Cannot be corrected. 7.5.08 note: no M&E tracks on seasons 1-7. All newer seasons are fine. 7.5.08 note: Season 7 is a best of/recap of seasons 1-6. Producer can terminate agreement if Distributor has not secured $50,000 (across Offshore, Wanna Go Fishing, American Gun Dog) by 23rd Jan 2009. 20.03.08 ""Offshore Adventures"" - winner of two 2007 Rocky Mountain (Regional) Emmy Awards - Best Editor and Best Sports - Program Feature/Segment/Regular Scheduled Daily or Weekly Program.","Seasons 12 & 13 (not in agreement) are available for distribution in Europe, as well as countries surrounding Russia such as Ukraine, but NOT Russia (Nick's e 30.4.08).",Quarterly - 45 days after each calendar quarter.,,Status 3Offshore Adventures,Offshore Adventures Series 11,D0167,Factual,"Fischer Productions, LLC",English,2007,12 x 30',,TRUE,FALSE,TRUE,FALSE,24/01/2008 00:00,23/01/2013 00:00,23/01/2018 00:00,,TRUE,37.5% with 10% of the 37.5% to be paid to Raleigh Werking,,"TERRITORY: Worldwide excluding USA and its possessions. RIGHTS: NON-EXCLUSIVE Non-theatrical, Free TV, Pay TV, Videogram & New Media Rights - provided any grant of any forms of downloading is encrypted and will not allow unlawful copying. NB: Distributor’s rights herein shall be non-exclusive with respect to the rights Producer has already granted or agrees to grant to ESPN and The Outdoor Channel. In addition, the Prod retains the right to exploit the Programmes via DVD and home video and via the internet through its own distribution channels.","Prior to agreeing license Indigo is to supply copies of the agreements for Producer’s approval, said approval not to be unreasonably withheld. Sub-Licensing up to five years beyond the Term provided said broadcaster has already been airing the Programme during at least one year of the Term.","Marketing expenses (including but not limited to flyers, brochures, advertising, print materials, posters, images, web digitisation, reasonable market expenses) and distribution costs (including but not limited to screening cassettes, promotional material and couriers) are included in the Distribution Fee. All actual and direct costs paid by Distributor relating to servicing agreements with licensees (but for the avoidance of doubt, not license or sub distribution fees themselves) (including but not limited to festival registration fees, transmission materials, duplication, shipping costs, insurance and scripts and transparencies) will be deducted from Gross Receipts unless paid for by Broadcaster or Licensee.",First refusal paragraph deleted - not granted.,"7.5.08 note: no M&E tracks on seasons 1-7. All newer seasons are fine. 7.5.08 note: Season 7 is a best of/recap of seasons 1-6. Producer can terminate agreement if Distributor has not secured $50,000 (across Offshore, Wanna Go Fishing, American Gun Dog) by 23rd Jan 2009. 20.03.08 ""Offshore Adventures"" - winner of two 2007 Rocky Mountain (Regional) Emmy Awards - Best Editor and Best Sports - Program Feature/Segment/Regular Scheduled Daily or Weekly Program.","Seasons 12 & 13 (not in agreement) are available for distribution in Europe, as well as countries surrounding Russia such as Ukraine, but NOT Russia (Nick's e 30.4.08).",Quarterly - 45 days after each calendar quarter.,,Status 3Offshore Adventures,Offshore Adventures Series 12,,Factual,"Fischer Productions, LLC",English,2008,12 x 30',,TRUE,FALSE,TRUE,FALSE,,,,,TRUE,ACQUISITION TITLE (Former commission with Fischer 37.5% with 10% of the 37.5% to be paid to Raleigh Werking),,"ACQUISITION TERRITORY: Worldwide excluding USA and its possessions. RIGHTS: NON-EXCLUSIVE Non-theatrical, Free TV, Pay TV, Videogram & New Media Rights - provided any grant of any forms of downloading is encrypted and will not allow unlawful copying. NB: Distributor’s rights herein shall be non-exclusive with respect to the rights Producer has already granted or agrees to grant to ESPN and The Outdoor Channel. In addition, the Prod retains the right to exploit the Programmes via DVD and home video and via the internet through its own distribution channels.","Prior to agreeing license Indigo is to supply copies of the agreements for Producer’s approval, said approval not to be unreasonably withheld. Sub-Licensing up to five years beyond the Term provided said broadcaster has already been airing the Programme during at least one year of the Term.","Marketing expenses (including but not limited to flyers, brochures, advertising, print materials, posters, images, web digitisation, reasonable market expenses) and distribution costs (including but not limited to screening cassettes, promotional material and couriers) are included in the Distribution Fee. All actual and direct costs paid by Distributor relating to servicing agreements with licensees (but for the avoidance of doubt, not license or sub distribution fees themselves) (including but not limited to festival registration fees, transmission materials, duplication, shipping costs, insurance and scripts and transparencies) will be deducted from Gross Receipts unless paid for by Broadcaster or Licensee.",First refusal paragraph deleted - not granted.,"2.8.13: eps 1 & 2 aren't in 720 HD, all other eps are.",,Quarterly - 45 days after each calendar quarter.,,Status 3Offshore Adventures,Offshore Adventures Series 13,,Factual,"Fischer Productions, LLC",English,2008,12 x 30',,TRUE,FALSE,TRUE,FALSE,,,,,TRUE,ACQUISITION TITLE (Former commission with Fischer 37.5% with 10% of the 37.5% to be paid to Raleigh Werking),,"ACQUISITION TERRITORY: Worldwide excluding USA and its possessions. RIGHTS: NON-EXCLUSIVE Non-theatrical, Free TV, Pay TV, Videogram & New Media Rights - provided any grant of any forms of downloading is encrypted and will not allow unlawful copying. NB: Distributor’s rights herein shall be non-exclusive with respect to the rights Producer has already granted or agrees to grant to ESPN and The Outdoor Channel. In addition, the Prod retains the right to exploit the Programmes via DVD and home video and via the internet through its own distribution channels.","Prior to agreeing license Indigo is to supply copies of the agreements for Producer’s approval, said approval not to be unreasonably withheld. Sub-Licensing up to five years beyond the Term provided said broadcaster has already been airing the Programme during at least one year of the Term.","Marketing expenses (including but not limited to flyers, brochures, advertising, print materials, posters, images, web digitisation, reasonable market expenses) and distribution costs (including but not limited to screening cassettes, promotional material and couriers) are included in the Distribution Fee. All actual and direct costs paid by Distributor relating to servicing agreements with licensees (but for the avoidance of doubt, not license or sub distribution fees themselves) (including but not limited to festival registration fees, transmission materials, duplication, shipping costs, insurance and scripts and transparencies) will be deducted from Gross Receipts unless paid for by Broadcaster or Licensee.",First refusal paragraph deleted - not granted.,,,Quarterly - 45 days after each calendar quarter.,,One Humanity - One Justice,One Humanity,D0219,Factual,Opiconsiva Investments 314 (PTY) Ltd,English,2014,Feature Doc (1 x 120' or 1 x 110') plus Concert Highlights program (1 x 135' or 3 x 45'),signed,TRUE,FALSE,TRUE,FALSE,05/11/2013 00:00,27/04/2024 00:00,27/04/2024 00:00,,TRUE,15% (To be paid into the collection account),,CLIP RIGHTS NOT GRANTED. TERM: 10 yrs from delivery. Rolling 2yrly periods thereafter (BUT SUBJECT TO MUSIC CLEARANCE AFTER 10 YRS) (below dates estimate delivery date) TERRITORY: Worldwide excluding Africa (whole Africa reverted to Producer 17.2.14). (Middle East/China was reserved but Producer did not secure sale so Middle East/China reverts to us) RIGHTS: Theatrical (however Producer shall retain Theatrical for the world premiere release on 27.4.14 in South Africa and UK. Thereafter revert to us) / Non-Theatric / TV / Video / Digital.,"1) UK, USA, Germany and multi country licenses and where sold with other producers programmes as bundles. 2) sublicensing beyond 27.4.24 as music has only been cleared up to this date Distributor shall give Producer written notice (including by e-mail) of any proposed sale which shall not to be unreasonably withheld or delayed. If Producer fails to respond within 5 (five) working days after notice of such proposed sale Producer’s approval shall be deemed given.","Marketing: to deduct US$120,000 from first receipts. Tx: costs included in Marketing $120k.",On subsequent series/off shoots etc.,"Music clearance: from Tony 4.11.13: ""We will be licencing both archive and music for ten years only. Anything more would break the bank. The contract has to be for the term only. If not you could do a deal in year 8, say for $25,000, for ten years that would cost us £500,000."" Budget: GB£2,107,256",,"qtrly. Plus have to ""consult with IDC, Zamani, Tribute and Producer on a quarterly basis together with the statements of the sales negotiations and sales concluded (cl. 9.6 of the Inter Party Agreement)",One Humanity (120' version) https://vimeo.com/103255306 Indigo2014,Status 3One Humanity - One Justice,One Humanity: Highlights And Extras,D0219,Factual,Opiconsiva Investments 314 (PTY) Ltd,English,2014,c. 120',signed,TRUE,FALSE,TRUE,FALSE,05/11/2013 00:00,27/04/2024 00:00,27/04/2024 00:00,,,15% (To be paid into the collection account),,"CLIP RIGHTS NOT GRANTED. TERM: 10 yrs from delivery. Rolling 2yrly periods thereafter (BUT SUBJECT TO MUSIC CLEARANCE AFTER 10 YRS) (below dates estimate delivery date) TERRITORY: Worldwide excluding South Africa. However Producer has reserved: 1) Middle East/North Africa until 31st December 2013, 2) China until February 28th 2014. If Producer hasn't secured deals then rights revert to Indigo. RIGHTS: Theatrical (however Producer shall retain Theatrical for the world premiere release on 27.4.14 in South Africa, UK, China, Sweden and USA. Thereafter revert to us) / Non-Theatric / TV / Video / Digital.","1) UK, USA, Germany and multi country licenses and where sold with other producers programmes as bundles. 2) sublicensing beyond 27.4.24 as music has only been cleared up to this date Distributor shall give Producer written notice (including by e-mail) of any proposed sale which shall not to be unreasonably withheld or delayed. If Producer fails to respond within 5 (five) working days after notice of such proposed sale Producer’s approval shall be deemed given.","Marketing: to deduct US$100,000 from first receipts. Tx: costs included in Marketing $100k.",On subsequent series/off shoots etc.,,,qtrly,,Status 3One Humanity - One Justice,One Humanity: The Series,D0219,Factual,Opiconsiva Investments 314 (PTY) Ltd,English,2014,3 x 45',signed,TRUE,FALSE,TRUE,FALSE,05/11/2013 00:00,27/04/2024 00:00,27/04/2024 00:00,,,15% (To be paid into the collection account),,"CLIP RIGHTS NOT GRANTED. TERM: 10 yrs from delivery. Rolling 2yrly periods thereafter (BUT SUBJECT TO MUSIC CLEARANCE AFTER 10 YRS) (below dates estimate delivery date) TERRITORY: Worldwide excluding South Africa. However Producer has reserved: 1) Middle East/North Africa until 31st December 2013, 2) China until February 28th 2014. If Producer hasn't secured deals then rights revert to Indigo. RIGHTS: Theatrical (however Producer shall retain Theatrical for the world premiere release on 27.4.14 in South Africa, UK, China, Sweden and USA. Thereafter revert to us) / Non-Theatric / TV / Video / Digital.","1) UK, USA, Germany and multi country licenses and where sold with other producers programmes as bundles. 2) sublicensing beyond 27.4.24 as music has only been cleared up to this date Distributor shall give Producer written notice (including by e-mail) of any proposed sale which shall not to be unreasonably withheld or delayed. If Producer fails to respond within 5 (five) working days after notice of such proposed sale Producer’s approval shall be deemed given.","Marketing: to deduct US$100,000 from first receipts. Tx: costs included in Marketing $100k.",On subsequent series/off shoots etc.,,,qtrly,,Status 3Opal Fever,Opal Fever,D0099,Factual,Piper Films,English,2004,"1 x 60', 4 x 30'",,TRUE,FALSE,TRUE,FALSE,26/09/2003 00:00,31/12/2099 00:00,31/12/2099 00:00,,TRUE,"30% + 5% marketing costs deductable (TV commission based on gross receipts, Video, non-theatric & educational based on actual receipts prior to deduction of withholding tax). But termination after 5 years only when Indigo has recouped US$5000 advance (50% to be paid on commencement of photography / 50% upon delivery and Indigo's acceptance of programme. Recoupable in first position from net receipts.",,TERM: expired 25.9.08 but as of 5.4.10 agreed rolling agreement to extend in 2yrly periods. TERRITORY: World excl Australia RIGHTS: All excl New Media. In Australia we have trapped audience rights Sublicense only within the Term of the Agreement (guess when we recoup advance).,"We can only grant licenses that go beyond the 25th Sept 2008 in the Major Territories, and then only with the approval of the prod. Major Territories: North America / UK / World as one pan territory / Europe as one pan territory / Scandinavia as one pan territory / France / Germany / Japan and Spain.",US$5000 advance - recoupable against net receipts. 5% charged for marketing costs. All costs for tx materials / VHS include duplication / shipping and freight costs to be paid by producer.,,"Aired in primetime on ABC. Although TV rights in Australia expressly excluded, if we do get a pan-territory deal that includes Australia Prod will try to negotiate a window with ABC.",,"Quarterly 30 days after 31 March / 30 June / 30 September / 31 December for first 2 years, thereafter every 6 months.",,Status 3Passport To Passion,Passport To Passion,D0175,Factual,Turn On Television Ltd,English,2001,8 x 30',,TRUE,FALSE,TRUE,FALSE,24/02/2009 00:00,23/02/2016 00:00,23/02/2019 00:00,,TRUE,35%,,"RIGHTS: Non-Theatric, Free TV, Pay TV, Videogram, New Media. TERRITORY: WW excl. UK/Eire (with C4). 20.2.09 Jennifer Bol from Digital Rights said we need to get ok from C4 (not C4i) if want to sell in UK/Eire. NOTE: music needs to be cleared. See General Notes comment below. Previous sales: Netherlands, Finland, Italy, Vatican City, San Marino, Capo D'istria, Monaco, Switzerland, Malta, UK, Channel Islands, Republic Of Ireland - all expired.",Only if sublicensing beyond 3 years after Term. Music needs clearance.,"Marketing included however agreed can recoup marketing expenses (including but not limited to flyers, brochures, advertising, print materials, posters, images, web digitisation, reasonable market expenses) and distribution costs (including but not limited to screening cassettes, promotional material and couriers) at capped cost £1,500 across all Turn On titles. Tx costs to recoup from gross receipts.",We do not have option to future series.,11.6.09 Music needs to be cleared. Angela received e-mail from BSkyB who received quotes from MCPS and PPL. Saved in Producer folder.,,,Ep 7,Status 3Pilot Fatigue,Pilot Fatigue,D0221,Factual,Fact Not Fiction Films,English,2012,1 x 52',signed,TRUE,FALSE,FALSE,FALSE,05/02/2014 00:00,31/12/2099 00:00,31/12/2099 00:00,,TRUE,30%,,"TERM: 5 years from sig with a break at 3 years, thereafter rolling 12 monthly periods. TERRITORY: WW RIGHTS: Theatrical, Non-Theatrical, TV, Video, Digital, Ancillary, Merchandising. NB: DFT Enterprises (sister company of Producer) has right to sell the titles via physical Discs online on its website but we can sell WW (UK of course on non-excl. basis)",,Marketing incl. Tx deductable.,,,,From signature until 36 months after delivery of all materials - every quarter. Thereafter every 6 months.,Pilot Fatigue https://vimeo.com/102527138 Password: Indigo2014,Status 3Portrait Of A City,Portrait Of A City,A0006,Factual,Vibe Productions Ltd,English,2010,6 x 30',,TRUE,TRUE,TRUE,FALSE,15/02/2011 00:00,31/12/2099 00:00,31/12/2099 00:00,,TRUE,As of 26.4.13 we're at 30% + 5% marketing. 1) 20% if grossed under £50k per programme; 2) 25% if grossed between £50k-£100k per programme; 3) 30% if grossed £100k + per programme. 5% marketing in first 3 yrs (does not apply after 15-Feb-14),,"TERM: 5 years with break after 3 yrs. Automatic rolling of 2 yr periods if not terminated. (NB: this is 2nd license agreement) TERRITORY: World RIGHTS: All TV, HV, Theatrical, Non-theatric, New Media, Merchandising, Ancillary","Licensing deals in France, Germany, Spain, Italy, UK, USA, Canada, Australia - 5 day response time with no response as an ok to proceed.",5% marketing cost deducted from gross receipts for first 3 yrs of term. Tx costs not included in 5% and to be deducted from gross receipts.,First refusal on all programming Producer develops during the term + exclusve first look on all content it develops or produces.,"Budget £4,000 per hour. Not commissioned by anyone. Delivery 15.5.10. HD materials being delivered with SD materials to be delivered upon request.",,Qtrly at 31 March 30 June 30 September 31 December and 45 days from such date,,Status 3Princess Diana's Legacy: Prince William and Prince Harry,Princess Diana’s Legacy: Prince William And Prince Harry,A0029,Factual,Infinity Video Ltd,English,1997,1 x 50',signed,TRUE,TRUE,FALSE,FALSE,01/05/2012 00:00,31/12/2099 00:00,31/12/2099 00:00,,,"35% (original agreement 50% but deferred from first gross receipts up to GB£35,000)",,TERM: from supplement letter (date below) rolling 12 (twelve) monthly periods with either party being entitled to terminate this Agreement by serving upon the other not less than 6 (six) calendar months written notice of such termination and to expire on the anniversary of each 12 (twelve) month period. TERRITORY: WW RIGHTS: All rights REQUIRES CLEARANCE. See other titles in Odyssey Catalogue.,,"Marketing included however Indigo can deduct from first gross receipts: 1) initial flier costs £750 across all titles; 2) Market attendences €2,500 per annum. TX costs deductable from Gross.",On subsequent series/offshoots etc.,,,"Qtr 1st 2 yrs, biannual thereafter",,Status 3Private Hitler's War,Private Hitler's War,,Factual,Beckmann Visual Publishing Ltd,English,2014,1 x 50',,TRUE,FALSE,TRUE,FALSE,,,,,,,,ACQUISITION TITLE. Third party rights as Beckmann have UK video rights only. As of 19.6.14 only permitted to pitch in Australia/NZ. Have to request if avail in other territories. Could be available in the UK if 'the price is right' as currently txing on Visions Of War channel who holds WW rights.,,,,,,,Private Hitler's War 1914-1918 https://vimeo.com/97917201 Password: Indigofilm2014,Status 3