Key Title,Title/Programme,Contract Ref#,Main Genre,Main Producer,Language,Production Year,Duration,Contracting Status,Active?,HD Available,Producer Approval?,In Catalogue?,Agreement Start Date,Last License Start Date,Agreement End Date,Date Fully Delivered,Visible On Interface,Commission,Back End,Rights Outline,Producer Approval,Costs,Option Notes,General Notes,Product Memo,Reporting,Best Screener,Status3 Minute Update,3 Minute Update,,Factual,,English,2014,,,TRUE,FALSE,FALSE,FALSE,,,,,TRUE,,,,,,,,,,,Status 399% Cannibal,99% Cannibal,A0066,Factual,Filmjungle.eu,English,2013,1 x 52',signed,TRUE,TRUE,TRUE,FALSE,05/10/2012 00:00,31/12/2099 00:00,31/12/2099 00:00,,,Presale Term: 25% with 15% deferred until finance raised and recoupable in the first position by Distributor during the Secondary Term. Secondary Term and Co-Production Term (if applicable): 25% + 5% marketing capped at £5k (anything above upon Prod approval),"Once fully financed where Dist contributes to financing parties will enter into a co-pro agreement. 1) ownership in perpetuity. 2) Distributor will share in the back end of the programme pro-rata'd at the percentage of financing brought by Distributor in order to complete the Budget through presales or other means, to a maximum of 50% (fifty percent).","PRE-SALE TERM: 6 mths from receipt agreed marketing material (below date Friday b4 MIPCOM). May be extended by 6 mthly periods to be agreed by both parties. POST SALE TERM: Upon fully financed and 5 yrs from full delivery, with break at 3 yrs with 6 mths notice. Rolling 2yrly periods with 6 mths notice. (Sub-License 7 yrs beyond end term) TERRITORY: World RIGHTS: Th, Non-Th, TV, Video, Digital, Anc, Merch",On Marketing costs exceeding £5k during Term.,5% marketing deductable from Gross but capped at £5k (anything above upon Prod approval). Tx costs deductable.,"On sequels, offshoots etc.",Budget: €60k-100k,,"From sig of Agr until 12 months after delivery of all Materials at quarterly intervals, and thereafter biannual",,Status 3Against The Odds,Against The Odds,D0142,Factual,6105289 Canada Inc,English,2004,1 x 44',,TRUE,FALSE,TRUE,FALSE,23/02/2007 00:00,22/02/2012 00:00,22/02/2017 00:00,,TRUE,35%,,License start on delivery of materials (above date when materials sent to Spektrum 06-1014-EC). Either party may terminate after 3 years. Worldwide - Free TV / Pay TV rights only.,If sub-license exceeds 5 years after the end of Indigo's rights,Transmission materials and shipping costs to be paid by producer. Marketing costs included in commission.,First Refusal on Future Series/Spin offs,,No,"Quarterly 45 days after 28 Feb / 31 May / 31 August / 30 November in first year, thereafter quarterly when monies received.",,Status 3Air Transport Auxiliary,Air Transport Auxiliary,D0221,Factual,Fact Not Fiction Films,English,2011,1 x 52',signed,TRUE,FALSE,FALSE,FALSE,05/02/2014 00:00,31/12/2099 00:00,31/12/2099 00:00,,TRUE,30%,,"TERM: 5 years from sig with a break at 3 years, thereafter rolling 12 monthly periods. TERRITORY: WW (see Product Memo for detail of license with UKTV) RIGHTS: Theatrical, Non-Theatrical, TV, Video, Digital, Ancillary, Merchandising. NB: DFT Enterprises (sister company of Producer) has right to sell the titles via physical Discs online on its website but we can sell WW (UK of course on non-excl. basis)",,Marketing incl. Tx deductable.,,,Previous sales: UKTV - UK/Eire - All TV - exp. 31.12.16,From signature until 36 months after delivery of all materials - every quarter. Thereafter every 6 months.,,Status 3"Altitude, Alcohol & Adultery","Altitude, Alcohol & Adultery",D0060,Factual,Happy Valley Films,English,1987,1 x 50',,TRUE,FALSE,TRUE,FALSE,15/05/2001 00:00,31/12/2099 00:00,31/12/2099 00:00,,TRUE,10% US Network / 30% all other including late night network and syndication in US and PBS / 50% non-theatric / educational,,Initially to 14-May-03 automatically renewable for consecutive periods of one year unless terminated by 3 month written notice. World excluding UK - All whether known now or herafter including but not limited to broadcast TV / cable / satellite / home video and all non-theatric and educational uses. All other rights need prior approval from producer.,approval required on CD-ROM / CDi Rights and all other not granted as above (for example New Media Rights / download rights). Please ensure client has sufficient protection rights in the Territories licensed (due to previous bad piracy experience). No response will be considered as acceptance after 3 working days.,TX material paid by producer. Marketing costs capped at 5% of gross sales. Producer to pay for marketing campaign after prior consent.,First Refusal on Future Series/Spin offs Not mentioned,With Greta Scacchi,look at previous sales attached to contract for second run info,Quarterly 30 days after 31 March / 30 June / 30 September / 31 December,,Status 3American Gun Dog,American Gun Dog Series 01,D0167,Factual,"Fischer Productions, LLC",English,2005,6 x 30',,TRUE,FALSE,TRUE,FALSE,24/01/2008 00:00,23/01/2013 00:00,23/01/2018 00:00,,TRUE,37.5% with 10% of the 37.5% to be paid to Raleigh Werking,,"TERRITORY: Worldwide excluding USA and its possessions. RIGHTS: NON-EXCLUSIVE Non-theatrical, Free TV, Pay TV, Videogram & New Media Rights - provided any grant of any forms of downloading is encrypted and will not allow unlawful copying. NB: Distributor’s rights herein shall be non-exclusive with respect to the rights Producer has already granted or agrees to grant to ESPN and The Outdoor Channel. In addition, the Prod retains the right to exploit the Programmes via DVD and home video and via the internet through its own distribution channels.","Prior to agreeing license Indigo is to supply copies of the agreements for Producer’s approval, said approval not to be unreasonably withheld. Sub-Licensing up to five years beyond the Term provided said broadcaster has already been airing the Programme during at least one year of the Term.","Marketing expenses (including but not limited to flyers, brochures, advertising, print materials, posters, images, web digitisation, reasonable market expenses) and distribution costs (including but not limited to screening cassettes, promotional material and couriers) are included in the Distribution Fee. All actual and direct costs paid by Distributor relating to servicing agreements with licensees (but for the avoidance of doubt, not license or sub distribution fees themselves) (including but not limited to festival registration fees, transmission materials, duplication, shipping costs, insurance and scripts and transparencies) will be deducted from Gross Receipts unless paid for by Broadcaster or Licensee.",First refusal paragraph deleted - not granted.,"Producer can terminate agreement if Distributor has not secured $50,000 (across Offshore, Wanna Go Fishing, American Gun Dog) by 23rd Jan 2009.",Season 3 of the Prog (not in dist agreement) - available WW Inc Europe but excl USA (Nick's e 30.4.08),Quarterly - 45 days after each calendar quarter.,AmericanGunDogSeries01 ep1 mov https://vimeo.com/95101685 Password: Indigo2014 American Gun Dog Se1 Ep4 https://vimeo.com/103991449 Password: Indigo2014,Status 3American Gun Dog,American Gun Dog Series 02,D0167,Factual,"Fischer Productions, LLC",English,2006,12 x 30',,TRUE,FALSE,TRUE,FALSE,24/01/2008 00:00,23/01/2013 00:00,23/01/2018 00:00,,TRUE,37.5% with 10% of the 37.5% to be paid to Raleigh Werking,,"TERRITORY: Worldwide excluding USA and its possessions. RIGHTS: NON-EXCLUSIVE Non-theatrical, Free TV, Pay TV, Videogram & New Media Rights - provided any grant of any forms of downloading is encrypted and will not allow unlawful copying. NB: Distributor’s rights herein shall be non-exclusive with respect to the rights Producer has already granted or agrees to grant to ESPN and The Outdoor Channel. In addition, the Prod retains the right to exploit the Programmes via DVD and home video and via the internet through its own distribution channels.","Prior to agreeing license Indigo is to supply copies of the agreements for Producer’s approval, said approval not to be unreasonably withheld. Sub-Licensing up to five years beyond the Term provided said broadcaster has already been airing the Programme during at least one year of the Term.","Marketing expenses (including but not limited to flyers, brochures, advertising, print materials, posters, images, web digitisation, reasonable market expenses) and distribution costs (including but not limited to screening cassettes, promotional material and couriers) are included in the Distribution Fee. All actual and direct costs paid by Distributor relating to servicing agreements with licensees (but for the avoidance of doubt, not license or sub distribution fees themselves) (including but not limited to festival registration fees, transmission materials, duplication, shipping costs, insurance and scripts and transparencies) will be deducted from Gross Receipts unless paid for by Broadcaster or Licensee.",First refusal paragraph deleted - not granted.,"Prod can terminate agreement if Distributor has not secured $50,000 (across Offshore, Wanna Go Fishing, American Gun Dog) by 23rd Jan 2009. 24-5-12 - DO NOT HAVE MATERIALS IN LONDON LAB.",Season 3 of the prog (not in dist agreement) - available WW Inc Europe but excl USA (Nick's e 30.4.08),Quarterly - 45 days after each calendar quarter.,AmericanGunDogSeries02 ep8 mov https://vimeo.com/95101686 Password: Indigo2014 American Gun Dog Se2 Ep4 https://vimeo.com/103923019 Password: Indigo2014,Status 3America's Choice,America's Choice,D0171,Factual,Strix Television AB,English,2008,3 x 45',,TRUE,FALSE,FALSE,FALSE,25/02/2010 00:00,31/12/2099 00:00,31/12/2099 00:00,,TRUE,32.50%,,"Term: 3 years from delivery (delivery as above date even though contract signed in 2008) wth automatic renewal of 2 yrs, then rolling 1 yr periods. Sublicensing term 5 yrs. Territory: WW excl. Sweden. Rights: All TV, Home Video, Merchandising, New Media, Ancillary, Mechandising, Theatrical, Non-Theatrical.",None,"Marketing inclusive in Commission (incl. Flyers, brochures, advertising, print materials, posters, images, web digitisation, market expenses) - anything over and above required by Producer will be payable by Producer in advance.",Option for future series is granted.,"NO M&E TRACKS and textless elements, no MCS Delivery date to Indigo 27th Oct 2008. Ready for TV4 Sweden 1st October 2008. Budget $480,000.",,From signature until 12 months after delivery of all materials - every quarter. Thereafter every 6 months.,Ep 3,Status 3Angel Without Wings,Angel Without Wings,D0221,Factual,Fact Not Fiction Films,English,2011,"1 x 105', 1 x 52'",signed,TRUE,FALSE,FALSE,FALSE,05/02/2014 00:00,31/12/2099 00:00,31/12/2099 00:00,,TRUE,30%,,"TERM: 5 years from sig with a break at 3 years, thereafter rolling 12 monthly periods. TERRITORY: WW RIGHTS: Theatrical, Non-Theatrical, TV, Video, Digital, Ancillary, Merchandising. NB: DFT Enterprises (sister company of Producer) has right to sell the titles via physical Discs online on its website but we can sell WW (UK of course on non-excl. basis)",,Marketing incl. Tx deductable.,,,,From signature until 36 months after delivery of all materials - every quarter. Thereafter every 6 months.,,Status 3Antony Gormley: Making Space,Antony Gormley: Making Space,D0168,Factual,Cross Street Films,English,2007,1 x 48',,TRUE,FALSE,TRUE,FALSE,24/10/2007 00:00,23/10/2012 00:00,23/10/2017 00:00,,TRUE,35% includes marketing and distribution. All TX costs are deductible from producer's share.,,"TERRITORY: Worldwide RIGHTS: Non-theatric, All TV & Video.","* Although prog under license in UK & Eire until 11th May 2010 with prod approval we can license TV rights to any broadcaster in the UK (except BBC, ITV or Channel5) from the 11th May 2009. In addition, with prod approval we are able to license TV rights to any broadcaster in Eire (except BBC, ITV or Channel5) from the 11th Nov 2008. * Prod/Channel 4 approval needed if we have to edit the prog for tx in the UK and/or Eire. * Prod/Channel 4 approval needed for any promo, mrktg or publicity activity in the UK and/or Eire.",,Break clause after 18 months and with 6 months notice. We have first right of refusal on any subsequent/related programming.,No M&E tracks Prog under license to Channel 4 in the UK & Eire until 11th May 2010. For any tx in the UK and/or Eire the prog must retain Channel 4 logo/credits,,6 monthly and within 45 days in first year and thereafter 45 days from such date in which monies are received.,Antony Gormley Making Space https://vimeo.com/95130818 Password: Indigo2014,Status 3Architect of Darkness,Architect of Darkness,,Factual,Beckmann Visual Publishing Ltd,English,2014,6 x 52',,TRUE,FALSE,TRUE,FALSE,,,,,,,,ACQUISITION TITLE (requiring finishing money as only 1 ep completed). Third party rights as Beckmann have UK video rights only. As of 19.6.14 only permitted to pitch in Australia/NZ. Have to request if avail in other territories. Could be available in the UK if 'the price is right' as WW rights held by Visions Of War channel.,,,,,,,,Status 3Art Detectives,Art Detectives,D0220,Factual,Riba Film International BV,English,2014,6 x 52',DM signed,TRUE,TRUE,FALSE,FALSE,12/11/2013 00:00,31/12/2099 00:00,31/12/2099 00:00,,,Pre-sale: 15% Post-sale: 30%,,"PRE-SALE TERM: 12 months with option to extend by 6 months. POST-SALE TERM: 10 years from receipt materials (below dates approx.) TERRITORY: World RIGHTS: Theatr, Non-Theatr, TV, Video, Digital, Merchandising, Ancillary",,Marketing included. Tx deductible,On subsequent series/spin offs,"Budget: €632,500 (being €550,000 budget plus Distributor's commission €82,500)",,qtrly,,Status 3Asteroid Impact,Asteroid Impact (aka Countdown to Impact),D0194,Factual,TV6 Limited,English,2009,1 x 50',signed,TRUE,TRUE,TRUE,FALSE,09/02/2010 00:00,31/12/2099 00:00,31/12/2099 00:00,,TRUE,30%,,"TERM: 10 years from delivery with break after 4 yrs, rolling thereafter of 1 year periods. TERRITORY: WW subject to NGC's holdbacks - see Titles folder for start dates of Indigo's rights. RIGHTS: Non Theatrical Rights (*), Free Television Rights (*), Pay Television Rights (*), Videogram Rights, New Media Rights (*), Ancillary Rights, Merchandising Rights. (*) The asterisked Rights are subject to NGC’s rights.","Distributor may sub-license the Rights for a period of up to three years beyond the Term, unless with prior producer approval. Should the Producer not respond to the Distributor’s notice within 7 (seven) working days then approval is deemed given.","Distributor shall deduct the following capped amounts from first receipts for all reasonable direct, third party marketing expenses (including flyers, brochures, advertising, print materials, posters, images, web digitisation) and distribution costs (including screening cassettes, promotional material and couriers): Year 1: US$2,500; Year 2: US$1,500; Year 3: US$1,000; later such costs are included in the Distribution Fee. All costs relating to servicing agreements with licensees (including but not limited to, transmission materials, duplication, shipping costs, insurance and scripts and transparencies) will be deducted from Gross Receipts. For the avoidance of doubt, the Distributor shall be responsible for all festival, market and overhead costs.","Distributor shall have first right of refusal on any Programme or any series based substantially on the Programme on such terms as may be mutually agreed between the parties provided always that if after 20 business days the parties cannot agree terms, the Producer shall be entitled to appoint another agent in its sole discretion without further obligation to Distributor. .","Budget: £250,000 Was tx on NGC's Naked Science block - first tx was 3.12.09. http://channel.nationalgeographic.com/episode/naked-science-countdown-to-impact-4652/Photos#tab-Overview",See Product Memo in Titles folder for NGC's territories/holdbacks and start dates of Indigo rights,At quarterly intervals as at 31 March 30 June 30 September and 31 December and within 45 (forty five) days from each such date during the first year of the Term and thereafter 45 days following each such date.,Asteroid Impact https://vimeo.com/95130819 Password: Indigo2014,Status 3Atacama - Flowering Desert,Atacama - Flowering Desert,D0041,Factual,Equilibrio Productions,Spanish (Latin),2000,"1 x 40' (English), 1 x 40' (Latin Spanish)",,TRUE,FALSE,TRUE,FALSE,01/06/2000 00:00,31/05/2011 00:00,31/05/2011 00:00,,TRUE,30%,,World excluding Chile - All rights. Term is 6 years from signature and thereafter automatically renewed for consecutive periods of one year each up to a maximum of 5 years unless terminated by at least 9 months by either party. Can only sublicense for a period which survives our Term (ie 31.6.11),Approval on CD Rom / CDi rights only. But Producer has gone bankrupt and 'disappeared'! Currently no-one to report to.,"Marketing (fliyers, VHSs, transparancies, posters) and all tx materials can be deducted from Gross Receipts",,Contract was never signed and producer has gone bankrupt.,No,No - not until we hear from copywrite owner of rights.,,Status 3Bangkok Bound,Bangkok Bound,D0175,Factual,Turn On Television Ltd,English,1999,6 x 30',,TRUE,FALSE,TRUE,FALSE,24/02/2009 00:00,23/02/2016 00:00,23/02/2019 00:00,,TRUE,35%,,"RIGHTS: Non-Theatric, Free TV, Pay TV, Videogram, New Media. TERRITORY: WW excl. UK/Eire (with C4). 20.2.09 Jennifer Bol from Digital Rights said we need to get ok from C4 (not C4i) if want to sell in UK/Eire. Previous sales: Sold to Foxtel - territory - australia (exp 30/07/2009) Netherlands, Finland, Italy, Vatican City, San Marino, Capo D'istria, Monaco, Switzerland, Malta, UK, Channel Islands, Republic Of Ireland, Hungary - all expired.",Only if sublicensing beyond 3 years after Term,"Marketing included however agreed can recoup marketing expenses (including but not limited to flyers, brochures, advertising, print materials, posters, images, web digitisation, reasonable market expenses) and distribution costs (including but not limited to screening cassettes, promotional material and couriers) at capped cost £1,500 across all Turn On titles. Tx costs to recoup from gross receipts.",We do not have option to future series.,,,,Ep 1 Bangkok Bound ep1 https://vimeo.com/95300606 Password: Indigo2014,Status 3"Battle Of The Somme, The","Battle Of The Somme, The",,Factual,Beckmann Visual Publishing Ltd,English,1916,1 x 72',,TRUE,FALSE,TRUE,FALSE,,,,,,,,ACQUISITION TITLE. Third party rights as Beckmann have UK video rights only. As of 19.6.14 only permitted to pitch in Australia/NZ. Have to request if avail in other territories. Could be available in the UK if 'the price is right' as currently txing on Visions Of War channel who holds WW rights.,,,,Digitally remastered in 2005,,,The Battle of the Somma https://vimeo.com/97940694 Password: Indigo2014,Status 3Bear Serenade,Bear Serenade,D0221,Factual,Fact Not Fiction Films,English,2011,1 x 52',signed,TRUE,FALSE,FALSE,FALSE,05/02/2014 00:00,31/12/2099 00:00,31/12/2099 00:00,,TRUE,30%,,"TERM: 5 years from sig with a break at 3 years, thereafter rolling 12 monthly periods. TERRITORY: WW RIGHTS: Theatrical, Non-Theatrical, TV, Video, Digital, Ancillary, Merchandising. NB: DFT Enterprises (sister company of Producer) has right to sell the titles via physical Discs online on its website but we can sell WW (UK of course on non-excl. basis)",,Marketing incl. Tx deductable.,,,,From signature until 36 months after delivery of all materials - every quarter. Thereafter every 6 months.,Bear Serenade https://vimeo.com/102514731 Password: Indigo2014,Status 3Beneath The Bonnet,Beneath The Bonnet Series 01,,Factual,,English,2013,6 to 13 x 52',not signed,TRUE,FALSE,FALSE,FALSE,,,,,,,,TBC,,,,,,,,Status 3Birding In...,Birding In...,D0186 (letter authorisation),Factual,"Red, Green & Blue Company Ltd, The",English,2003,13 x various,,TRUE,FALSE,TRUE,FALSE,16/07/2007 00:00,31/12/2099 00:00,31/12/2099 00:00,,TRUE,done on a deal by deal basis but 35% incl. marketing costs. have informal agreement with producer.,,1) UK non-excl. Secondary TV rights 2) WW excluding UK exclusive TV & Home Video,Yes,TX costs to be recouped from gross receipts.,,Producer selling DVDs on own website. Has no M&E tracks. Various YOP: Alaska 2003 China 1999 Canada 1999 Florida 1998 Texas 1997 Spain 1996 Turkey 1996 Britain 1997 Morocco 1996 Eastern Europe 1995 Israel 1995 Arctic 1994 Mallorca 1994,,,,Status 3Birth Of The Bomb,Birth Of The Bomb,,Factual,Beckmann Visual Publishing Ltd,English,1994,1 x 50',,TRUE,FALSE,TRUE,FALSE,,,,,,,,ACQUISITION TITLE. Third party rights as Beckmann have UK video rights only. As of 19.6.14 only permitted to pitch in Australia/NZ (all rights) and UK TV. Have to request if avail in other territories.,,,,,Rerun in Australia (sales info not avail),,Birth of the Bomb https://vimeo.com/98052248 Password: Indigo2014,Blackout,Blackout,D0089,Factual,BBC,English,2001,1 x 52',,TRUE,FALSE,FALSE,FALSE,14/06/2002 00:00,13/06/2012 00:00,31/12/2099 00:00,,TRUE,"4.6.10: as of this date have not recouped. So continue to defer the 30%. Indigo defers all commission until BBC recoups US$260,000 from both titles (Kissing & Blackout). If Indigo does not close $195,000 by 31-Dec-03 (18m after delivery), BBC can take back programmes and Indigo gets no commission. If Indigo hits target, we get 30%.","contractually yes but we don't. Should also submit artwork for Video releases for approval. If shipping / tx costs will be over US1,000 in any quarter",TV excluding US / English Canada / UK. Home Video excluding US and Eng Canada. Can present proposal for publishing and merchandising rights if territories are av - Standard TV rights / non-standard TV rights / Home Video Rights + CCTV (but not airlines though we had sold rights...),"contractually yes but we don't. Should also submit artwork for Video releases for approval. If shipping / tx costs will be over US1,000 in any quarter","Tx and shipping costs can be billed back. Cannot exceed US$1,000 in any quarter without prior approval",First Refusal on Future Series/Spin offs,,No,Quarterly 45 days after 31 March / 30 June / 30 September / 31 December,Blackout https://vimeo.com/85146241 Password: Indigo2014,Status 3Blastproof,Blastproof,D0088,Factual,BBC,English,2001,1 x 52',,TRUE,FALSE,FALSE,FALSE,19/01/2001 00:00,18/01/2011 00:00,31/12/2099 00:00,,TRUE,30%,contractually yes but we don't. Should also submit artwork for Video releases for approval.,Bangladesh / Brunei / Cambodia / China / Hong Kong / India / Indonesia / Japan / Korea / Laos / Macau / Malaysia / Mongolia / Myanmar / Nepal / Pakistan / Philippines / Singapore / Sri Lanka / Taiwan / Thailand / Vietnam / Australia / Cook islands / Fiji / French Polynesia / Maldives / Nauru / New Caledonia / New Zealand / Niue / Papua New Guinea / Vanatu / Wallis & Futuna / Western Samoa / France / Spain / Bahrain / Iran / Iraq / Israel / Jordan / Kuwait / Qatar / Saudi Arabia / Syria / (but not incl. UAE) / Turkey / Yemen / Lebanon / Oman / Gibralta / Portugal / home video in UK / French Canada (see e-mail and not incl. Germany) - Standard TV rights / non-standard TV rights / Home Video Rights + CCTV (but not airlines though we have sold...),contractually yes but we don't. Should also submit artwork for Video releases for approval.,All costs including tx materials included in Indigo commission. BBC keeps withholding tax,First Refusal on Future Series/Spin offs,,No,Quarterly 45 days after 31 March / 30 June / 30 September / 31 December,,Status 3